{
  "$schema": "https://json-schema.org/draft/2020-12/schema",
  "$id": "https://code-abyss.local/personal-skill-system/expert-source-family-scorecard.schema.json",
  "title": "Portable Personal Skill Expert-Source Family Scorecard Schema",
  "type": "object",
  "additionalProperties": false,
  "required": [
    "schema-version",
    "generated-at",
    "sources",
    "experimental-pack",
    "summary",
    "families"
  ],
  "properties": {
    "schema-version": {
      "type": "integer",
      "const": 1
    },
    "generated-at": {
      "$ref": "#/$defs/isoDateTime"
    },
    "sources": {
      "type": "object",
      "additionalProperties": false,
      "required": [
        "family-registry",
        "experimental-pack"
      ],
      "properties": {
        "family-registry": {
          "$ref": "#/$defs/portablePath"
        },
        "experimental-pack": {
          "$ref": "#/$defs/portablePath"
        }
      }
    },
    "experimental-pack": {
      "type": "object",
      "additionalProperties": false,
      "required": [
        "file",
        "parseError",
        "includes"
      ],
      "properties": {
        "file": {
          "$ref": "#/$defs/portablePath"
        },
        "parseError": {
          "anyOf": [
            {
              "$ref": "#/$defs/nonEmptyString"
            },
            {
              "type": "null"
            }
          ]
        },
        "includes": {
          "type": "array",
          "uniqueItems": true,
          "items": {
            "$ref": "#/$defs/portablePath"
          }
        }
      }
    },
    "summary": {
      "type": "object",
      "additionalProperties": false,
      "required": [
        "total-families",
        "active-families",
        "archived-families",
        "families-with-parse-errors",
        "active-families-with-parse-errors",
        "experimental-pack-parse-errors",
        "active-raw-source-skills",
        "active-integrated-source-skills",
        "active-integrated-modules",
        "active-unmapped-raw-sources",
        "active-stale-mapped-sources",
        "active-missing-pack-includes",
        "archived-pack-includes"
      ],
      "properties": {
        "total-families": {
          "type": "integer",
          "minimum": 0
        },
        "active-families": {
          "type": "integer",
          "minimum": 0
        },
        "archived-families": {
          "type": "integer",
          "minimum": 0
        },
        "families-with-parse-errors": {
          "type": "integer",
          "minimum": 0
        },
        "active-families-with-parse-errors": {
          "type": "integer",
          "minimum": 0
        },
        "experimental-pack-parse-errors": {
          "type": "integer",
          "minimum": 0
        },
        "active-raw-source-skills": {
          "type": "integer",
          "minimum": 0
        },
        "active-integrated-source-skills": {
          "type": "integer",
          "minimum": 0
        },
        "active-integrated-modules": {
          "type": "integer",
          "minimum": 0
        },
        "active-unmapped-raw-sources": {
          "type": "integer",
          "minimum": 0
        },
        "active-stale-mapped-sources": {
          "type": "integer",
          "minimum": 0
        },
        "active-missing-pack-includes": {
          "type": "integer",
          "minimum": 0
        },
        "archived-pack-includes": {
          "type": "integer",
          "minimum": 0
        }
      }
    },
    "families": {
      "type": "array",
      "items": {
        "type": "object",
        "additionalProperties": false,
        "required": [
          "id",
          "title",
          "source",
          "label",
          "status",
          "integrationFile",
          "rawRoot",
          "expectedPortable",
          "parseError",
          "rawRootExists",
          "rawSourceSkills",
          "integratedSourceSkills",
          "integratedModules",
          "unmappedRawSources",
          "staleMappedSources",
          "experimentalPackRequired",
          "experimentalPackIncluded",
          "experimentalPackStatus"
        ],
        "properties": {
          "id": {
            "$ref": "#/$defs/registryId"
          },
          "title": {
            "$ref": "#/$defs/nonEmptyString"
          },
          "source": {
            "$ref": "#/$defs/registryId"
          },
          "label": {
            "$ref": "#/$defs/nonEmptyString"
          },
          "status": {
            "type": "string",
            "enum": [
              "active",
              "archived"
            ]
          },
          "integrationFile": {
            "$ref": "#/$defs/portablePath"
          },
          "rawRoot": {
            "type": "string",
            "minLength": 1
          },
          "expectedPortable": {
            "type": "boolean"
          },
          "parseError": {
            "anyOf": [
              {
                "$ref": "#/$defs/nonEmptyString"
              },
              {
                "type": "null"
              }
            ]
          },
          "rawRootExists": {
            "type": "boolean"
          },
          "rawSourceSkills": {
            "type": "integer",
            "minimum": 0
          },
          "integratedSourceSkills": {
            "type": "integer",
            "minimum": 0
          },
          "integratedModules": {
            "type": "integer",
            "minimum": 0
          },
          "unmappedRawSources": {
            "$ref": "#/$defs/skillNameList"
          },
          "staleMappedSources": {
            "$ref": "#/$defs/skillNameList"
          },
          "experimentalPackRequired": {
            "type": "boolean"
          },
          "experimentalPackIncluded": {
            "type": "boolean"
          },
          "experimentalPackStatus": {
            "type": "string",
            "enum": [
              "aligned",
              "missing-active-include",
              "archived-still-included",
              "not-required"
            ]
          }
        }
      }
    }
  },
  "$defs": {
    "nonEmptyString": {
      "type": "string",
      "minLength": 1
    },
    "skillName": {
      "type": "string",
      "pattern": "^[a-z0-9]+(?:-[a-z0-9]+)*$",
      "minLength": 1,
      "maxLength": 64
    },
    "registryId": {
      "type": "string",
      "pattern": "^[a-z0-9]+(?:-[a-z0-9]+)*$",
      "minLength": 1,
      "maxLength": 160
    },
    "portablePath": {
      "type": "string",
      "pattern": "^(?!/)(?!.*(?:^|/)\\.\\.(?:/|$)).+$",
      "minLength": 1
    },
    "isoDateTime": {
      "type": "string",
      "format": "date-time"
    },
    "stringList": {
      "type": "array",
      "uniqueItems": true,
      "items": {
        "$ref": "#/$defs/nonEmptyString"
      }
    },
    "skillNameList": {
      "type": "array",
      "uniqueItems": true,
      "items": {
        "$ref": "#/$defs/skillName"
      }
    }
  }
}
